<?xml version="1.0" encoding="UTF-8"?>
<!DOCTYPE tienda SYSTEM "ordenes.dtd">
<ordenes>
<orden>
<id>87</id>
<cliente>alfonso</cliente>
<producto>mofeta</producto>
<cliente>
<nombre>rafita</nombre>
<direccion>avpalomares</direccion>
</cliente>
<producto>
<nombre>lejia</nombre>
<cantidad>7391</cantidad>
</producto>
</orden>
</ordenes>
